{
  "schemaVersion": 1,
  "corpusVersion": "field-v1",
  "evidenceKind": "field_review",
  "cases": [
    {
      "caseId": "trace-integrity-parent-child-failure",
      "caseKind": "trace_integrity",
      "tracePaths": [".evidence/trace/run_parent.jsonl", ".evidence/trace/run_child.jsonl"],
      "scenario": "parent-child ordering and real subagent failure attribution",
      "detector": null,
      "expectedFinding": null,
      "observedFinding": null,
      "confidence": null,
      "reviewerId": "phase2-review",
      "reviewedAt": "2026-08-10T09:00:00.000Z",
      "coverage": "unknown",
      "limitations": ["post-tool effect observation was unavailable", "not a detector-quality label"],
      "replayDigest": "sha256:400e2b9b62e94f2adc533ea41cdc7ba8c18b392e4f22407c855b8bd958bd6066",
      "detectorOutputPath": null,
      "detectorOutputDigest": null,
      "holdout": false
    }
  ]
}
